season,episode,name,air_date,show_id,show_name
4,65,"Easy Knitting, Dolls, Knitted Fashion Show",2002-11-11 17:00:00,11930,Carol Duvall Show
5,5,"Ribbon Cards, Preserving Momentos, Restoration Tips",2002-11-18 17:00:00,11930,Carol Duvall Show
5,7,"Lamp Bases & Shades, Mini Bookends, Needlepoint",2002-11-20 17:00:00,11930,Carol Duvall Show
5,8,"Basket Weaving, Mini Memory Book",2002-11-21 17:00:00,11930,Carol Duvall Show
5,9,"Stamp-A-Throne, Stationery, Memory Book Leftovers",2002-11-22 17:00:00,11930,Carol Duvall Show
5,12,"Scrapbook Stamps, Rug Hooker Group Visit, Surface Stitching",2002-12-30 17:00:00,11930,Carol Duvall Show
5,13,"Place Mats, Foam Core Lesson & Bank, Chalk Cloth",2002-12-31 17:00:00,11930,Carol Duvall Show
5,14,"Paper Engineering, Paper Bag Basket, Viewer Projects",2003-01-02 17:00:00,11930,Carol Duvall Show
5,16,"Heart Lamp, Wire Weaving, Penny Pincher Cards & Letters",2003-01-06 17:00:00,11930,Carol Duvall Show
5,17,"Crafter's Chair, Envelopes and Cards",2003-01-07 17:00:00,11930,Carol Duvall Show
5,18,"Candle Beauty, Rose-Back Mirror, New Products",2003-01-08 17:00:00,11930,Carol Duvall Show
5,22,"Moveable Murals, Country Crock Creations Winners",2003-01-14 17:00:00,11930,Carol Duvall Show
5,23,"Found Materials Collage, Wedding Book Authors, Craft Books",2003-01-15 17:00:00,11930,Carol Duvall Show
5,24,"Sante Fe Weavers, Gift Wrap Center, Tassel Making",2003-01-16 17:00:00,11930,Carol Duvall Show
5,25,"Santa Fe Doll Art, Stuffed Cubes, Cake Decorating Tips",2003-01-17 17:00:00,11930,Carol Duvall Show
5,26,"Dutch Folk Art, Kimono Wall Hanging, Frames, Lizard Box",2003-01-20 17:00:00,11930,Carol Duvall Show
5,27,"Ribbon Flowers, Stenciled Tabletop & Chair Cover, Corruboard Organizer",2003-01-21 17:00:00,11930,Carol Duvall Show
5,29,"Window Decor Paper Cutouts, Wood Carver, Bows",2003-01-23 17:00:00,11930,Carol Duvall Show
5,30,"Dolls, Friendship Plate, Rigid Wrap Bowls",2003-01-24 17:00:00,11930,Carol Duvall Show
5,31,"Rustic Barn 3-D Glass Painting, Felt Rug Stenciling",2003-01-27 17:00:00,11930,Carol Duvall Show
5,32,"Opaque Hearts Wall Hanging, Woodburning, Wood Postcards",2003-01-28 17:00:00,11930,Carol Duvall Show
5,34,"Hawaiian Quilt Paper Cutting, Santa Fe Doll Art, Knitting for Kids",2003-01-30 17:00:00,11930,Carol Duvall Show
5,35,"NAMTA Show, Scrapbook On A Wall, Chenille Rabbit",2003-01-31 17:00:00,11930,Carol Duvall Show
5,36,"Cupcakes, New Products, NAMTA Convention",2003-02-03 17:00:00,11930,Carol Duvall Show
5,37,"Fabric Painting, Ribbon Flowers, Notebook Page Tips",2003-02-04 17:00:00,11930,Carol Duvall Show
5,38,"Handmade Paper Embossing, Sticker Demo",2003-02-05 17:00:00,11930,Carol Duvall Show
5,39,"Name Paper Cutting, Autry Museum, New Products",2003-02-06 17:00:00,11930,Carol Duvall Show
5,41,"Fimo Earring Organizer, Tomato-Cage Dolls",2003-02-18 17:00:00,11930,Carol Duvall Show
5,43,"Doll Wigs, Clay Switch Plates & Votives",2003-02-19 17:00:00,11930,Carol Duvall Show
5,44,"Mosaic Shelf, PVC Pipe Candlesticks, Crafts ala Carte",2003-02-20 17:00:00,11930,Carol Duvall Show
5,46,"Faux Ivory Box, Polymer Clay Pen, Planter Footstool",2003-02-24 17:00:00,11930,Carol Duvall Show
5,47,"Storage Footstool, Rice-Paper Lampshade",2003-02-25 17:00:00,11930,Carol Duvall Show
5,49,"Hat Cockades, Hooked Rugs, Painted Mosaic",2003-02-27 17:00:00,11930,Carol Duvall Show
5,52,"Felt Bowl, Rubber Stamp Craft Projects",2003-03-04 17:00:00,11930,Carol Duvall Show
5,54,"Fabric Flowers, Handblown Glass, Scrapbook Products",2003-03-06 17:00:00,11930,Carol Duvall Show
6,1,"Sockodile, Stamping Innovations",2003-03-10 17:00:00,11930,Carol Duvall Show
6,2,"Dragonfly Watering Can, Ann Arbor Summer Fair, Stamped Cards",2003-03-11 17:00:00,11930,Carol Duvall Show
6,7,"Finger Painted Vase, Ann Arbor Fair, Paper Clocks",2003-03-17 17:00:00,11930,Carol Duvall Show
6,8,"Slider & Envelope Cards, Mosaic Hurricane Lamp, Craft Storage Tips",2003-03-18 17:00:00,11930,Carol Duvall Show
6,9,"Beads & Dragonfly Frame, Terra Cotta Cookie Jar",2003-03-19 17:00:00,11930,Carol Duvall Show
6,10,"Window Treatments, Wood Carvers, Decorative Pulls",2003-03-20 17:00:00,11930,Carol Duvall Show
6,12,"Spiral Mobile, Lampshades, Paper Portfolios",2003-03-25 17:00:00,11930,Carol Duvall Show
6,13,"Polymer Clay Faces, Paper Organizer",2003-03-26 17:00:00,11930,Carol Duvall Show
10,62,"Fushsia Flower Fever, Sugar Eggs",2003-03-27 17:00:00,11930,Carol Duvall Show
6,15,"Clock Making, Duet Stamping",2003-03-28 17:00:00,11930,Carol Duvall Show
6,16,"Kaleidoscope, Stitching 101, Basket Weaver",2003-03-31 17:00:00,11930,Carol Duvall Show
6,17,"Chenille Cat, Dyeing for Doll Making",2003-04-01 17:00:00,11930,Carol Duvall Show
6,18,"Polymer Clay Mobile, Roly-Poly Pillows, Sgraffito Painting",2003-04-02 17:00:00,11930,Carol Duvall Show
6,20,"Neck Dolls, Cardboard Tray, Native American Flutes",2003-04-04 17:00:00,11930,Carol Duvall Show
6,21,"Stenciled Headboard, Polymer Clay Bunny Pins, Stacked Rock Sculpture",2003-04-07 17:00:00,11930,Carol Duvall Show
6,23,"Stained Glass & Toy Soap, Batik Paper, Scrapbook Organizers",2003-04-09 17:00:00,11930,Carol Duvall Show
6,24,"Angel Doll, Painting Tools",2003-04-10 17:00:00,11930,Carol Duvall Show
6,25,"Trompe L'oeil, Grannies Garden, Ribbon Butterflies",2003-04-11 17:00:00,11930,Carol Duvall Show
6,27,"Memory Box Frame, Crop-a-Lot, Paper Bowls",2003-04-17 17:00:00,11930,Carol Duvall Show
6,28,"Crib Bench, Cookie Cutter & Jelly Roll Soap",2003-04-21 17:00:00,11930,Carol Duvall Show
6,33,"Polymer Clay Face Canes, Handmade Lampshades",2003-04-28 17:00:00,11930,Carol Duvall Show
6,34,"Stamping with Gold Leaf, Mix Media Artist, Mosaics",2003-04-29 17:00:00,11930,Carol Duvall Show
6,36,"Stamping on Metal, Leather and Wood; Vellum Cards",2003-05-01 17:00:00,11930,Carol Duvall Show
6,37,"Satin Burn Purse and Scarf, Stamped Wall Border",2003-05-02 17:00:00,11930,Carol Duvall Show
6,38,"Surface Stitch Place Mats, Stamping Tricks",2003-05-05 17:00:00,11930,Carol Duvall Show
6,40,"Business Talk, Iron-on Transfers, Batik Eggs",2003-05-09 17:00:00,11930,Carol Duvall Show
6,41,"Embellished Candles, Ted Gall Sculpture, Viewer Napkin Cards",2003-05-12 17:00:00,11930,Carol Duvall Show
6,42,"Wire People Lapel Pin, Paste Paper Book",2003-05-13 17:00:00,11930,Carol Duvall Show
6,43,"Raw Edge Collage, Navajo Weaving, Beaded Pens",2003-05-14 17:00:00,11930,Carol Duvall Show
6,44,"Stamped Gift Book, Painting Techniques",2003-05-15 17:00:00,11930,Carol Duvall Show
6,45,"Basket Greeting Card, Unusual Painting Tools",2003-05-16 17:00:00,11930,Carol Duvall Show
6,46,"Bloomer Greeting Cards, Ribbon Crafts, Coppersmith",2003-05-19 17:00:00,11930,Carol Duvall Show
6,49,"Painting Techniques, Flower Pounding, Footstools",2003-05-22 17:00:00,11930,Carol Duvall Show
6,50,"Chocolate Crafts, Mini Scrapbook",2003-05-23 17:00:00,11930,Carol Duvall Show
6,51,"Paper Pillows, Sticker Cards",2003-05-26 17:00:00,11930,Carol Duvall Show
6,55,"Gift Bags, Mosaic House, Toolbox Card",2003-05-30 17:00:00,11930,Carol Duvall Show
6,57,"Stapled Art Frame, Fabric Stamping, Paper Mache",2003-06-03 17:00:00,11930,Carol Duvall Show
6,58,"Plate Art, Fountain Artist, Shrink Plastic Project",2003-06-04 17:00:00,11930,Carol Duvall Show
6,59,"Tin Night Lights, Watercolor Stamping, Decoupage",2003-06-05 17:00:00,11930,Carol Duvall Show
6,60,"Easy Dimensional Beads, Ghost Beads",2003-06-06 17:00:00,11930,Carol Duvall Show
7,5,"Suitcase Ottoman, Wooded Spoons, Dolls",2003-06-13 17:00:00,11930,Carol Duvall Show
7,6,"Egg Carton Sculpture, Glass Artist, Can Storage",2003-06-16 17:00:00,11930,Carol Duvall Show
7,7,"Doily Towel and Purse, Funky Frames",2003-06-17 17:00:00,11930,Carol Duvall Show
7,8,"Winter Heart Wreath, Tin Can Crafts",2003-06-18 17:00:00,11930,Carol Duvall Show
7,9,"Floater Card, Scrap Metal Lamps, Air Freshener Doll",2003-06-19 17:00:00,11930,Carol Duvall Show
7,10,"Decoupage Convention, Sockhopper, Ceramic Tile Card",2003-06-23 17:00:00,11930,Carol Duvall Show
7,11,Painting Techniques & Party Plates,2003-06-24 17:00:00,11930,Carol Duvall Show
7,12,"Brayered Paper, Faux Floor Finish, Beaded Creations",2003-06-25 17:00:00,11930,Carol Duvall Show
7,13,"Decorating With Theorem, Miniatures",2003-06-26 17:00:00,11930,Carol Duvall Show
7,14,"Tea Bag Folding, Painted Needlepoint",2003-06-27 17:00:00,11930,Carol Duvall Show
7,16,"Magic Shakin' Card, Stained Glass Artists, Flower Petal Mosaics",2003-07-01 17:00:00,11930,Carol Duvall Show
7,18,"Stencil Vertical Borders, Inlaid Pottery, Decorative Shoeboxes",2003-07-03 17:00:00,11930,Carol Duvall Show
7,20,"Silver Clay Heart, Fiber Burnout, Marketing Crafts",2003-07-07 17:00:00,11930,Carol Duvall Show
7,21,"Washi Paper Pins & Boxes, Pillow",2003-07-08 17:00:00,11930,Carol Duvall Show
7,22,"Negora Nuri Faux Finish, Stencil Show, Flowerpot, Magazine Rack",2003-07-09 17:00:00,11930,Carol Duvall Show
7,23,"Scrap Velvet Projects, Spinning, Craft Products",2003-07-10 17:00:00,11930,Carol Duvall Show
7,25,Memory Album Cover,2003-07-11 17:00:00,11930,Carol Duvall Show
7,24,"Polymer Clay Finials, Stencil Cutting, Retro Tote Bags",2003-07-14 17:00:00,11930,Carol Duvall Show
7,26,"Japanese Doll Pendant, Iron Floor Cloth",2003-07-15 17:00:00,11930,Carol Duvall Show
7,28,"Wool Suit Rug, Garage Sale Glass",2003-07-17 17:00:00,11930,Carol Duvall Show
7,29,"Gilded Boxes, Needle Case / Pincushion",2003-07-18 17:00:00,11930,Carol Duvall Show
7,30,"Votive Wraps, Fiber Art, Floor Pillow",2003-07-21 17:00:00,11930,Carol Duvall Show
7,33,"Creative Backgrounds, Memorabilia Crafts",2003-07-24 17:00:00,11930,Carol Duvall Show
7,34,"Rubber Stamp Tattoos, Doll Pin Cushion",2003-07-25 17:00:00,11930,Carol Duvall Show
7,35,"Photo Transfer Clay, Designer Tassels",2003-07-28 17:00:00,11930,Carol Duvall Show
7,37,"Punch Art, Love Letters Organization, Rag Muffin Dolls",2003-07-30 17:00:00,11930,Carol Duvall Show
7,38,"Stenciled Chair, Black Pearl Workshop, Wrap Dolls",2003-07-31 17:00:00,11930,Carol Duvall Show
7,39,"Stamped Soap, Polymer Clay Frames, Jeweler Visit",2003-08-01 17:00:00,11930,Carol Duvall Show
7,40,"Etched Glass, Stamped Linens, Botanical Ribbon & Cord",2003-08-04 17:00:00,11930,Carol Duvall Show
7,42,"Denim Shirt Dress-Up, Oriental Brush Painting, Wire Tips & Tricks",2003-08-06 17:00:00,11930,Carol Duvall Show
7,43,"Embossed Pin, Textured Card, Clay Pendants",2003-08-07 17:00:00,11930,Carol Duvall Show
7,44,"Hand-Dyed Paper & Boxes, Crochet Artist, Faux Mosaics",2003-08-08 17:00:00,11930,Carol Duvall Show
7,45,Botanical Spheres,2003-08-11 17:00:00,11930,Carol Duvall Show
7,48,"Photo Transfer Surfaces, Clay Bracelets",2003-08-14 17:00:00,11930,Carol Duvall Show
7,49,"Scottish Potter, Clay Jewelry, Footstools",2003-08-15 17:00:00,11930,Carol Duvall Show
7,50,"Needlepoint Mosaic, Doll Artist, Craft Products",2003-08-18 17:00:00,11930,Carol Duvall Show
7,51,"Elegant Entertaining, Stamped Clay Game, Floor Cloth Artist",2003-08-19 17:00:00,11930,Carol Duvall Show
7,53,"Scrapbook Pages, Wire Candelabra",2003-08-21 17:00:00,11930,Carol Duvall Show
7,54,Shrink Plastic Jewelry,2003-08-22 17:00:00,11930,Carol Duvall Show
7,55,"Wall Letters, Chalk Pastel Embossing, Beads",2003-08-25 17:00:00,11930,Carol Duvall Show
7,56,"Elegant Cards, Trash Boxes, Beeswax Candles",2003-08-26 17:00:00,11930,Carol Duvall Show
7,58,"Bark Masks, Kitchen Decor",2003-08-28 17:00:00,11930,Carol Duvall Show
7,59,"Wire Vase, Wine Glass Candle, Brooch Exhibit",2003-08-29 17:00:00,11930,Carol Duvall Show
7,60,"Dot & Doodles, Trash Crafting, Wearable Art",2003-09-01 17:00:00,11930,Carol Duvall Show
11,1,"Place Mats, Sculpture Artist, Lantern",2003-09-02 17:00:00,11930,Carol Duvall Show
11,2,"Screen Door Flowers, Fan Flair",2003-09-03 17:00:00,11930,Carol Duvall Show
11,3,"Asian Shadow Box, Metal Bead Necklaces, Products",2003-09-04 17:00:00,11930,Carol Duvall Show
11,5,"Un-Bead-Able Veggies, Dog & Cat Journals",2003-09-08 17:00:00,11930,Carol Duvall Show
11,9,"Sponged Backgrounds, ""Batik"" Lampshades, Viewer Projects",2003-09-12 17:00:00,11930,Carol Duvall Show
11,14,"Paper Flowers, Holy Cows!, Reverse Faux Finish",2003-09-19 17:00:00,11930,Carol Duvall Show
11,15,"Embossed Copper, Recycled Crafts, Geodesic Mobile",2003-09-22 17:00:00,11930,Carol Duvall Show
11,20,"Picture Frame, Bunny's Burned Box, Sock Monkey Shoebox",2003-09-22 17:00:00,11930,Carol Duvall Show
11,16,"Millefiori Story, Cast Paper Artist, Ribbon Lampshades",2003-09-23 17:00:00,11930,Carol Duvall Show
11,19,"Decorative Tin Chest, Quilted Scrapbooking",2003-09-26 17:00:00,11930,Carol Duvall Show
11,24,"Medallion Card, Wasabi Bowls, Frame, Trunk & Baby Shower Favor",2003-09-26 17:00:00,11930,Carol Duvall Show
11,25,"Journals, Gourd Artist, Paint & Pen Products",2003-09-29 17:00:00,11930,Carol Duvall Show
11,28,"Gel Candles, Found Object Artist, Mizuhiki Card",2003-10-02 17:00:00,11930,Carol Duvall Show
11,30,"Stamping Tips & Tricks, Copper Luminarias, Sew Center & Wire Organizing",2003-10-06 17:00:00,11930,Carol Duvall Show
11,31,"Velvet Photo Mats, Shibori Artist, Poly Clay Vessels & Sticks",2003-10-07 17:00:00,11930,Carol Duvall Show
11,32,"Wallpaper Cards, Carver, Coule",2003-10-08 17:00:00,11930,Carol Duvall Show
11,34,"Three-Minute Postcards, Sweater Dolls, Craft Books",2003-10-10 17:00:00,11930,Carol Duvall Show
11,39,"CD Pins, Wood Turner, Painted Pillow Shams",2003-10-20 17:00:00,11930,Carol Duvall Show
11,41,"Beaded Hair Pins, Colorful Mosiacs, Pop-Up Box",2003-10-22 17:00:00,11930,Carol Duvall Show
11,42,"Glass Plate, Crackle Cards, Postcard Display",2003-10-23 17:00:00,11930,Carol Duvall Show
11,44,"Poly Clay Photocopy, Decorated Clock, Paper Products",2003-10-27 17:00:00,11930,Carol Duvall Show
11,46,"Poly-Clay Cloisonne, Beaded Gourd Necklace",2003-10-31 17:00:00,11930,Carol Duvall Show
11,47,"Miniature Photo Album, Luminaria Artist, Organizer",2003-11-03 17:00:00,11930,Carol Duvall Show
11,48,"Photo Weaving, Kimono Wall Hangings",2003-11-04 17:00:00,11930,Carol Duvall Show
11,49,"Dishtowel Doll, Festival Artist, Shimmery Glimmery Craft Powders",2003-11-05 17:00:00,11930,Carol Duvall Show
11,50,"Stamped Metal Clay Pendant, Decorated Dining",2003-11-06 17:00:00,11930,Carol Duvall Show
11,54,"Glittery Window Clings, Collage Artist, Poly-Clay Mouse",2003-11-12 17:00:00,11930,Carol Duvall Show
11,55,"Folded Dinner Party, Mask Artist, Wearable Fabric Art",2003-11-13 17:00:00,11930,Carol Duvall Show
7,63,"Chocolate Holiday Centerpieces, Gingerbread Gift Box",2003-12-10 17:00:00,11930,Carol Duvall Show
7,65,"Bug Ornaments, Ribbon Wrap Gift Boxes, Holiday Lighting Ideas",2003-12-10 17:00:00,11930,Carol Duvall Show
7,61,"Twig Star, Wreath Jig, Ivy in Holiday Crafts",2003-12-16 17:00:00,11930,Carol Duvall Show
7,62,"Christmas Village Church, Wreath Card",2003-12-24 17:00:00,11930,Carol Duvall Show
14,2,"Polymer Clay Cabochon Necklace, Clown Clock",2004-02-24 17:00:00,11930,Carol Duvall Show
14,8,"Dimensional Scrapbooking, Whimsical Foam Art, Little 9-Fold Hello Card",2004-03-03 17:00:00,11930,Carol Duvall Show
13,52,"Creative Soap Making, Miniatures Artist, Dimensional Fabric Cards",2004-03-09 17:00:00,11930,Carol Duvall Show
14,13,"Leopard License Frame, Faux Punched Tins, New Products: ""Tool, Tricks & Totes""",2004-03-10 17:00:00,11930,Carol Duvall Show
13,54,"Dyed Ribbon Flowers, Mud Cloth Art",2004-03-11 17:00:00,11930,Carol Duvall Show
14,14,"Whimsical Stamped Purse, Glass Transfer Mobile, Shoebox: Tender Hands Dolls",2004-03-11 17:00:00,11930,Carol Duvall Show
13,57,"Fabulous Fountains, Tapestry Weaving, Easy Home Accessories",2004-03-16 17:00:00,11930,Carol Duvall Show
13,60,"Simple Backgrounds, Bow Tie Necklace, Shoebox:Homemade Light Box, Cardboard Designs",2004-03-19 17:00:00,11930,Carol Duvall Show
14,21,"Shaving Cream Card, Decorative Bedroom Accessories",2004-03-29 17:00:00,11930,Carol Duvall Show
14,25,"Classy Leather Frame, Ornate Ceramic Pitchers, Magnet Clock",2004-04-02 17:00:00,11930,Carol Duvall Show
14,5,"Victorian Sugar Shade, Exotic Art Boxes, Shoebox: Easter Eggs, Cards",2004-04-05 17:00:00,11930,Carol Duvall Show
14,26,"Eraser-Clay Pencil Toppers, Video Box Covers; Refrigerator Magnets; Cards and Illusion Braid",2004-04-05 17:00:00,11930,Carol Duvall Show
14,27,"Onion Scarf, Aquatic Fiber Sculpture, Bronze Powder Stenciling",2004-04-06 17:00:00,11930,Carol Duvall Show
8,65,"Batik Egg Art, Chocolate Clay Roses, Viewer Ideas",2004-04-07 17:00:00,11930,Carol Duvall Show
14,28,"Pyramid Pop-Up Cards, Pam's Magnet Calendar",2004-04-07 17:00:00,11930,Carol Duvall Show
12,62,"Carved Goose Egg, Decorating Sugar Cookies, Royal Icing",2004-04-09 17:00:00,11930,Carol Duvall Show
14,31,"Sea Sponged Box, Pops A Lot Cards",2004-04-12 17:00:00,11930,Carol Duvall Show
14,32,"Folded Photo Page, Steel Sculptures, Shoebox: Planter Bench; Quilt Rack; Doll Transfer Photo; Paint Storage",2004-04-13 17:00:00,11930,Carol Duvall Show
14,33,"Shrink Art Collage, Pull-Open Diorama Cards",2004-04-14 17:00:00,11930,Carol Duvall Show
14,34,"Ghost Stamp Scrapbooking, Bumblebee Tableware",2004-04-15 17:00:00,11930,Carol Duvall Show
14,35,"Veggie Patch Pens, Closet Pole Doll",2004-04-16 17:00:00,11930,Carol Duvall Show
14,36,"Cookie/Card Combo, Cultural Fabric Figures, Puzzle Notepad",2004-04-19 17:00:00,11930,Carol Duvall Show
14,38,"Asian Art Box, Metal Inlay Pins, Shoebox: Napkin Holders; Asian Room Screen",2004-04-21 17:00:00,11930,Carol Duvall Show
14,40,"Sea/Sun Wind Chime, Solar Hand Pressed Photographs, Stacked Paper Keys Fobs",2004-04-23 17:00:00,11930,Carol Duvall Show
14,41,"Eggcellent Kitchen Decorations, Tantalizing Tins, Tall Iron Vases",2004-04-26 17:00:00,11930,Carol Duvall Show
14,42,"Twist Art Fruit, Felt Applique Purse",2004-04-27 17:00:00,11930,Carol Duvall Show
14,44,"Tiled Mirror Frame, Metal Transfer Bracelet, Shoebox: 3-D Little Red Riding Hood Picture",2004-04-29 17:00:00,11930,Carol Duvall Show
14,45,"Shrinking Star Bag, Knit To Be Gelled, Shoebox: Votive Candle Boats, Birthday Card",2004-04-30 17:00:00,11930,Carol Duvall Show
14,46,"Chocolate Pincushions, Wall Collage Bud Vase, Nostalgic Doll Art",2004-05-04 17:00:00,11930,Carol Duvall Show
14,48,"Expanding Foam Cards, Polymer Clay Tile Bracelet",2004-05-10 17:00:00,11930,Carol Duvall Show
14,49,"Southwestern Fireplace Screen, Earth Formed Vessels, Magic Pull Up Card",2004-05-11 17:00:00,11930,Carol Duvall Show
14,51,"Facile Frames, Clear Texture Glassworks, Memory Wood",2004-05-13 17:00:00,11930,Carol Duvall Show
14,54,"Metal and Ribbon Placemats, Old World Painting, Polymer Clay Earring and Holder",2004-05-18 17:00:00,11930,Carol Duvall Show
14,56,"Sunny Polymer Necklace, Topiary Luminaria, New Product: ""Scrapper's Delight""",2004-05-20 17:00:00,11930,Carol Duvall Show
14,57,"Glass Butterfly Vase, Transfer Mosaic Necklace, Polymer Clay Fireplace Tiles, Polymer Clay Pictures, Pincushion Decor",2004-05-21 17:00:00,11930,Carol Duvall Show
14,59,"Primitive Clay Doll, Decorative Fruit Sculptures, Ring A Ding Challenge",2004-05-25 17:00:00,11930,Carol Duvall Show
15,14,"Clay Eyeglass Case, ""Man"" Made Assembled Book",2004-06-17 17:00:00,11930,Carol Duvall Show
12,2,"Rubber Stamped Glass, Blacksmith Artist, Clay Bunny & Giraffe",2004-06-29 17:00:00,11930,Carol Duvall Show
12,3,"Leather Journal, Ceramic Instruments, Tag Art",2004-06-30 17:00:00,11930,Carol Duvall Show
12,4,"Domino Box, I Love the Night-Light",2004-07-01 17:00:00,11930,Carol Duvall Show
12,5,"Slideshow Lampshade, Bronze Sculptures, Mini Book Box",2004-07-02 17:00:00,11930,Carol Duvall Show
12,6,"Pin Cushions on Pedestals, Ya/Ya, Shoebox",2004-07-05 17:00:00,11930,Carol Duvall Show
12,7,"Mica Luminaria, Don't Throw That Away, Papier-Mache Game Box",2004-07-06 17:00:00,11930,Carol Duvall Show
12,10,"Etched Bottles, Paper Greenhouse",2004-07-09 17:00:00,11930,Carol Duvall Show
12,11,"Terrific ""Tile"" Box, People Lamps, Pinwheel Plant Jewelry Stakes",2004-07-12 17:00:00,11930,Carol Duvall Show
12,12,"Spice Tin Games, Kitchen Utensil Assemblage, Clay Ribbon Rose Mirror",2004-07-13 17:00:00,11930,Carol Duvall Show
12,13,"Vest Explosion Cards, Art Brooms, Dimensional Wall Art, Shoebox: Cutting Lines",2004-07-14 17:00:00,11930,Carol Duvall Show
12,14,"Cool Clocks, Family Faces Photo Book",2004-07-15 17:00:00,11930,Carol Duvall Show
12,15,"Sponged Floor Cloth, Paper Doll Closet, Clothes & Hangers",2004-07-16 17:00:00,11930,Carol Duvall Show
12,16,"Polymer Clay Mosiacs, Scroll Saw Apples",2004-07-19 17:00:00,11930,Carol Duvall Show
12,18,"Accordion Books, St. Elmo's Village, Flower Quilling",2004-07-21 17:00:00,11930,Carol Duvall Show
12,19,"Groovy Gourds, Stamped Pendant",2004-07-22 17:00:00,11930,Carol Duvall Show
12,21,"Velvet Ribbon Lampshade, Netsuke Artist, Transfer Bead & Bracelet",2004-07-26 17:00:00,11930,Carol Duvall Show
12,22,"Butterfly Key Chain, Pop-Up Spinner Card, Shoebox: Variations",2004-07-27 17:00:00,11930,Carol Duvall Show
12,23,"Rusted Shelf & Veggie Knobs, Faux Copper Switch Plate, Knitted Beaded Bracelet",2004-07-28 17:00:00,11930,Carol Duvall Show
12,24,"Sculpted Paper Sun, Techno-Romantic Jewelry, Metal Wrapped Candles",2004-07-29 17:00:00,11930,Carol Duvall Show
12,25,"""Stained Glass"" Lampshade, Sculptural Planters, DNA Spiral Bracelet",2004-07-30 17:00:00,11930,Carol Duvall Show
12,26,"Faux Felted Feline, Enamel Jewelry, Shoebox: Mosaic Spool Tables",2004-08-02 17:00:00,11930,Carol Duvall Show
12,27,"Stenciled Stepping Stone, Polygon Pop Card & Envelope",2004-08-03 17:00:00,11930,Carol Duvall Show
12,28,"Polymer Clay Bowl, Wire Hair People, Shoebox: Mini Scrapbooks",2004-08-04 17:00:00,11930,Carol Duvall Show
12,29,"Crafty Recipes, Fused Glass Masks, Collaged Fruit",2004-08-05 17:00:00,11930,Carol Duvall Show
12,30,"Mizuhiki Bracelet, Crafty New Products, Teacup Photo Holder",2004-08-06 17:00:00,11930,Carol Duvall Show
12,31,"Invitation Box, Metal Purse, Shoebox: Smart Tricks",2004-08-09 17:00:00,11930,Carol Duvall Show
12,32,"Japanese Shadow Box, Stamped Director's Chair",2004-08-10 17:00:00,11930,Carol Duvall Show
12,35,"Faux Batik Tees, Marriage In Glass, Beaded Spool Knitting",2004-08-13 17:00:00,11930,Carol Duvall Show
12,36,"Festive Button Banner, Scrapbook Convention, New Craft Products",2004-08-16 17:00:00,11930,Carol Duvall Show
12,37,"Ribbon Embellished Scarf, Bargello Paper ""Quilt""",2004-08-17 17:00:00,11930,Carol Duvall Show
12,38,"Hexagon Illusion Pages, Beaded Glass Roses",2004-08-18 17:00:00,11930,Carol Duvall Show
12,39,"Tussy Mussies, Stamped Acetate Diorama Cards, Shoebox: Jar Tops, Turtle",2004-08-19 17:00:00,11930,Carol Duvall Show
12,40,"Decorative Stemware, Table Bouquet",2004-08-20 17:00:00,11930,Carol Duvall Show
12,41,"Painted Honey Bee Trivet, Cajun Wood Carver, Pop-Up Clown",2004-08-23 17:00:00,11930,Carol Duvall Show
12,42,"Folded Square Pocket Card, Polymer Clay Tea Pot, Shoebox: Felt Dolls",2004-08-24 17:00:00,11930,Carol Duvall Show
12,44,"Tropical Flower Accent, Papier Mache Sculptures, Tooled Copper Frame",2004-08-26 17:00:00,11930,Carol Duvall Show
12,45,"Placemat Projects, Metal Magic Butterfly, New Craft Books",2004-08-27 17:00:00,11930,Carol Duvall Show
12,46,"Terra Cotta Clay Basket, CD Box, Remote Control 'Garage'",2004-08-30 17:00:00,11930,Carol Duvall Show
12,47,"Fiber Pendant, Wrap It Up, Envelope Gift Bag",2004-08-31 17:00:00,11930,Carol Duvall Show
12,48,"Aliens And Their Pets, Ultimate Scrapbooking Room, Shoebox: Boxes & Cards",2004-09-01 17:00:00,11930,Carol Duvall Show
12,50,"Recycled Cabinet Door, Enamel-Look Jewelry, Shoebox: Mini Fabric Bags",2004-09-03 17:00:00,11930,Carol Duvall Show
12,51,"Faux Stained Glass Balloons, Beaded Baskets, Embossed Velvet Mobile",2004-09-06 17:00:00,11930,Carol Duvall Show
12,52,"Moroccan Mirror, Wish Upon A Star Card",2004-09-07 17:00:00,11930,Carol Duvall Show
12,53,"Cat Garden Flag, Etched Glass Artist, Pocket Gift Bags",2004-09-08 17:00:00,11930,Carol Duvall Show
12,56,"Clay Fabric Lampshade, Envelope Book/Card",2004-09-13 17:00:00,11930,Carol Duvall Show
12,57,"Beaded Flowers, Kinetic Sculpture, Fabric Box",2004-09-14 17:00:00,11930,Carol Duvall Show
12,58,"Paper Lion Mask, Elevate Your Scrapbook, Clay Coasters",2004-09-15 17:00:00,11930,Carol Duvall Show
12,59,"Book In A Box, Canvas Sheet Plastic Purse",2004-09-16 17:00:00,11930,Carol Duvall Show
12,60,"Floral Swag, Recipes for Glue, Shoebox: Adapted Crafts",2004-09-17 17:00:00,11930,Carol Duvall Show
10,1,"Notable Notebooks, Tribals Sculpture, Baby Shower Centerpiece",2004-09-20 17:00:00,11930,Carol Duvall Show
10,4,"Wire Mobile, Tapestries, Card Holder",2004-09-23 17:00:00,11930,Carol Duvall Show
10,6,"Velvet Overlay, Cardboard Art, Towel Bunny",2004-09-27 17:00:00,11930,Carol Duvall Show
10,8,"Botanical Tiles, Silhouettes, Mini Pie Safe",2004-09-29 17:00:00,11930,Carol Duvall Show
10,9,"Polymer Clay Necklace, Frame in a Frame",2004-09-30 17:00:00,11930,Carol Duvall Show
10,11,"Stamped Sleepover, National Black Arts Festival, New Products",2004-10-06 17:00:00,11930,Carol Duvall Show
10,12,"Boomerangs, Paper Beads, Stump Work",2004-10-07 17:00:00,11930,Carol Duvall Show
10,13,"Sprouting Jeans, Clay Sock Monkey",2004-10-12 17:00:00,11930,Carol Duvall Show
10,14,"Fur Stool, Needlepoint Canvas, Wire Glass Decor",2004-10-13 17:00:00,11930,Carol Duvall Show
10,15,"Collage Art Dolls, Beaded Watch Band",2004-10-14 17:00:00,11930,Carol Duvall Show
10,17,"Needle Weaving, Barn Wood Designs, Viewer Ideas",2004-10-20 17:00:00,11930,Carol Duvall Show
10,18,"Building a Mural, Temari Buttons",2004-10-21 17:00:00,11930,Carol Duvall Show
10,16,"Resist Paper Cards, Doll Furniture, Metal Sculpture",2004-10-24 17:00:00,11930,Carol Duvall Show
10,20,"Floral Tapestry Box, Tatted Flower Card",2004-10-28 17:00:00,11930,Carol Duvall Show
10,21,"It's Mary's Business, Ten Women Co-op, Viewer Call",2004-11-01 17:00:00,11930,Carol Duvall Show
10,23,"Stained Table, Kimono Gift Box, Stone Picture Frame, Folded Suits",2004-11-03 17:00:00,11930,Carol Duvall Show
